{
  "$schema": "https://json-schema.org/draft/2020-12/schema",
  "type": "object",
  "additionalProperties": false,
  "required": [
    "schemaVersion",
    "rigId",
    "geometryStatus",
    "coordinateFrame",
    "display",
    "headEyeOffsetM",
    "weaponMuzzleOffsetM",
    "weaponBoreLocalDirection",
    "weaponZeroQuaternionXyzw",
    "trackerSerials",
    "calibration"
  ],
  "properties": {
    "schemaVersion": {
      "const": 1
    },
    "rigId": {
      "type": "string",
      "minLength": 1
    },
    "geometryStatus": {
      "const": "synthetic_unmeasured"
    },
    "coordinateFrame": {
      "const": "unity_left_handed_m"
    },
    "display": {
      "type": "object",
      "additionalProperties": false,
      "required": [
        "lowerLeftM",
        "lowerRightM",
        "upperLeftM"
      ],
      "properties": {
        "lowerLeftM": {
          "$ref": "#/$defs/vec3"
        },
        "lowerRightM": {
          "$ref": "#/$defs/vec3"
        },
        "upperLeftM": {
          "$ref": "#/$defs/vec3"
        }
      }
    },
    "screenBottomHeightAboveFloorM": {
      "type": "number",
      "minimum": 0.1,
      "maximum": 3
    },
    "headEyeOffsetM": {
      "$ref": "#/$defs/vec3"
    },
    "weaponMuzzleOffsetM": {
      "$ref": "#/$defs/vec3"
    },
    "weaponBoreLocalDirection": {
      "$ref": "#/$defs/vec3"
    },
    "weaponZeroQuaternionXyzw": {
      "type": "array",
      "minItems": 4,
      "maxItems": 4,
      "items": {
        "type": "number",
        "minimum": -1,
        "maximum": 1
      }
    },
    "trackerSerials": {
      "type": "object",
      "additionalProperties": false,
      "required": [
        "head",
        "weapon"
      ],
      "properties": {
        "head": {
          "type": "string",
          "minLength": 1
        },
        "weapon": {
          "type": "string",
          "minLength": 1
        }
      }
    },
    "calibration": {
      "type": "object",
      "additionalProperties": false,
      "required": [
        "status",
        "calibrationId",
        "rigId"
      ],
      "properties": {
        "status": {
          "const": "synthetic_only"
        },
        "calibrationId": {
          "type": "string",
          "minLength": 1
        },
        "rigId": {
          "type": "string",
          "minLength": 1
        }
      }
    }
  },
  "$defs": {
    "vec3": {
      "type": "array",
      "minItems": 3,
      "maxItems": 3,
      "items": {
        "type": "number",
        "minimum": -1000,
        "maximum": 1000
      }
    }
  }
}
