{
  "schemaVersion": 1,
  "rigId": "synthetic-rig-001",
  "geometryStatus": "synthetic_unmeasured",
  "coordinateFrame": "unity_left_handed_m",
  "display": {
    "lowerLeftM": [
      -0.6,
      -0.3375,
      1.5
    ],
    "lowerRightM": [
      0.6,
      -0.3375,
      1.5
    ],
    "upperLeftM": [
      -0.6,
      0.3375,
      1.5
    ]
  },
  "headEyeOffsetM": [
    0,
    0,
    0
  ],
  "weaponMuzzleOffsetM": [
    0,
    0,
    0.3
  ],
  "weaponBoreLocalDirection": [
    0,
    0,
    1
  ],
  "weaponZeroQuaternionXyzw": [
    0,
    0,
    0,
    1
  ],
  "trackerSerials": {
    "head": "SYNTHETIC-HEAD",
    "weapon": "SYNTHETIC-WEAPON"
  },
  "calibration": {
    "status": "synthetic_only",
    "calibrationId": "synthetic-identity",
    "rigId": "synthetic-rig-001"
  },
  "screenBottomHeightAboveFloorM": 1.2192
}
